Video_content,Release_time,The_video_duration,Estimated_Sales_volume_(pieces),Estimated_sales_amount,Number_of_likes,Number_of_comments,Number_of_reposts,Name
成功没有固定模式，只要尽心了尽力了付出了努力了就很自豪！只要经历了承受了磨练了提高了就很成功！,06-08 08:36:53,9秒,--,--,79871,1021,361,Beibei Tu
你们觉得他说得有道理吗？@梅尼耶 #百万创意大赛,06-07 14:59:01,16秒,--,--,197616,1687,489,Beibei Tu
都说梅尼耶是直男我不信！结果…@梅尼耶 #百万创意大赛,06-06 14:27:30,16秒,--,--,274027,3096,859,Beibei Tu
生活本身就是一种竞技，对手不是别人，对手恰恰就是我们自己，不断超越昨天的自己，才能遇见更好的自己@薇娅viya,06-06 12:38:51,6秒,--,--,44348,1125,271,Beibei Tu
教你们怎么样画出好看的微笑唇~@MAC魅可 #MAC丘比特唇釉,06-06 10:30:15,2分31秒,1,210,25625,232,72,Beibei Tu
教你如何轻松快速提升自己#笑带高光,06-05 17:49:04,1分37秒,244,16046,29416,175,168,Beibei Tu
平时刷“学废了”都出来！手残党都能学会的保姆级 【增发】教程来啦！,06-03 13:57:27,1分6秒,276,26433,49632,1208,274,Beibei Tu
快艾特你的姐妹一起拍把！@薇娅viya#爱心发射,06-02 13:01:27,10秒,--,--,60856,1419,229,Beibei Tu
为什么我做什么她都针对我？#抖音618好物节,06-02 11:00:59,8秒,--,--,30260,380,184,Beibei Tu
这回都有了，你们还想要嘛？赶紧来吧#抖音618好物节,06-02 10:35:27,8秒,--,--,17144,460,95,Beibei Tu
有时候人的崩溃就在一瞬间 我终于回来了！,06-02 09:41:20,37秒,--,--,21252,638,47,Beibei Tu
早起傻一天，这个日常通勤都可的妆容你们觉得怎么样？,06-02 07:04:48,1分21秒,--,--,19632,1904,299,Beibei Tu
拯救夏日脱妆！自带磨皮美颜的铁皮粉饼你拥有了吗？！,06-01 15:00:00,1分49秒,245,7080,60387,601,115,Beibei Tu
,,,,,,,,
凡是过往皆是序章，所有将来皆可盼。#如果当时 #舞蹈 #秋天的第一支舞,08-31 16:48:58,25秒,--,--,46642,1636,415,Liu Fang Posture Corrector
万物需要阳光，生活需要方向，新的一天，用最美的姿态，遇见最好的自己。#形体训练 #优雅仪态 #阳光 #最好的我们,08-31 06:45:35,14秒,--,--,37946,829,605,Liu Fang Posture Corrector
生活再糟糕也不妨碍你变好，别让琐事遮住了你眼里的光。#形体训练 #生活 #眼里的光 #优雅仪态,08-30 06:45:31,14秒,--,--,34805,722,987,Liu Fang Posture Corrector
每天给自己一个微笑，笑容里有幸福，删除昨天的烦恼，开启今天的快乐。#桃花笑 #快乐 #幸福,08-29 16:53:47,13秒,--,--,130880,5337,1211,Liu Fang Posture Corrector
在未来的日子里，你要做的只有一件事，努力把自己变得优秀。#形体训练 #优秀 #努力 #优雅仪态,08-29 06:45:40,14秒,--,--,40747,990,549,Liu Fang Posture Corrector
多少岁不重要，看起来像几岁才重要。你想要最好的生活，就先让生活看到最好的你。#生活 #优雅仪态,08-28 17:01:00,13秒,--,--,116574,3502,2400,Liu Fang Posture Corrector
命是弱者的借口，运是强者的谦辞，辉煌肯定有，就看怎么走。#形体训练 #努力 #优雅仪态,08-28 06:45:43,15秒,--,--,30347,702,707,Liu Fang Posture Corrector
以热爱的方式生活，就是对自己最好的温柔。#热爱生活 #最好的优雅留给你,08-27 16:51:13,15秒,--,--,77135,2199,1504,Liu Fang Posture Corrector
最完美的状态，不是你从不失误，而是你从没放弃努力和成长。#努力 #形体训练 #成长,08-27 06:47:23,14秒,--,--,19179,485,463,Liu Fang Posture Corrector
没有一帆风顺，那就一起荡起双桨，乘风破浪！#让我们荡起双桨 #乘风破浪的姐姐 #舞蹈,08-26 17:48:18,15秒,--,--,158621,5734,2699,Liu Fang Posture Corrector
任何时候都可以开始做自己喜欢的事，时间、年龄都不是界限，除非你拿它为难自己。#爱自己 #形体训练 #时间#最好的优雅留给你,08-26 06:45:57,16秒,--,--,40660,1075,534,Liu Fang Posture Corrector
歌以咏言，舞以尽意。未必光芒万丈，但要温暖有光。#舞蹈 #古风舞蹈#变装 #古风,08-25 16:57:33,16秒,--,--,86588,4101,647,Liu Fang Posture Corrector
真正喜欢和想要的，没有一样可以轻易得到，这就是努力的理由。#形体训练 #努力 #自律,08-25 06:47:15,15秒,--,--,40416,860,809,Liu Fang Posture Corrector
姐妹们，你们喜欢哪种风格的舞蹈呀。#南北方舞蹈大战 #舞蹈,08-24 16:51:40,24秒,--,--,52350,2312,481,Liu Fang Posture Corrector
路是自己选的，没有输赢，只有值不值得。任何经历过的事情，不是得到，就是学到。#形体训练 #学习#优雅仪态,08-24 06:49:46,18秒,--,--,36369,823,499,Liu Fang Posture Corrector
不是每一朵花都必须成为玫瑰，你可以大胆做自己，独一无二#舞蹈 #新疆#玫瑰 #民族舞蹈舞出民族特色,08-23 16:49:13,15秒,--,--,100025,4082,689,Liu Fang Posture Corrector
从容貌到能力，请努力让自己更出色。#努力#形体训练#优雅仪态,08-23 07:34:04,14秒,--,--,37538,742,597,Liu Fang Posture Corrector
哪有什么天才！坚持做你喜欢的事情，这本身就是一种天赋。#敦煌飞天 #舞蹈 #坚持#飞天舞,08-22 16:52:28,17秒,--,--,37870,1781,409,Liu Fang Posture Corrector
任何事情都应该努力尝试，因为你无法知道，什么样的事将会改变你的一生。#改变#努力#形体训练,08-22 06:49:06,15秒,--,--,30405,792,720,Liu Fang Posture Corrector
努力经营当下，直至未来可期。努力经营自己，直至万物明朗。今天的水袖舞你们喜欢吗??#舞蹈 #水袖舞,08-21 16:53:18,15秒,--,--,92139,4593,525,Liu Fang Posture Corrector
人生三把钥匙，接受，改变，放开，接受不了就改变，改变不了就放开，生活皆是成长，成长便是人生。#形体训练,08-21 06:45:54,14秒,--,--,51025,1032,1624,Liu Fang Posture Corrector
努力经营生活中的美好，并借由着这些美好，一直积极向上！你们喜欢的异域舞来啦！#舞蹈 #异域风情 #形体训练,08-20 17:01:51,13秒,--,--,119546,5747,1170,Liu Fang Posture Corrector
你要偷偷努力，努力绽放，不负生命，不负年华。#努力#形体训练#优雅仪态,08-20 06:46:42,16秒,--,--,19130,484,671,Liu Fang Posture Corrector
和蹦床公主何雯娜一起给大家带来闺蜜舞蹈????#热爱105度的你 #闺蜜 #舞蹈,08-19 17:03:02,14秒,--,--,46189,1458,326,Liu Fang Posture Corrector
形体仪态训练，让美成为自身的能力，刻苦学习，潜心修炼，然后默默的经验时光。#形体训练#优雅#学习,08-19 06:45:44,15秒,--,--,27214,599,697,Liu Fang Posture Corrector
气质团的姐妹们，今晚7点来我直播间，跟蹦床公主何雯娜一起练习形体#骁气十足舞蹈挑战#这是什么神仙古风舞,08-18 17:58:32,14秒,--,--,85068,2648,923,Liu Fang Posture Corrector
气质团的姐妹们，今晚7点和蹦床公主何雯娜一起来我直播间练习形体，不见不散哦??@何雯娜,08-18 07:09:24,29秒,--,--,61765,1478,598,Liu Fang Posture Corrector
把优雅变成习惯，让优秀习以为常。塑造外在形体美，挖掘内在心灵美。#优雅仪态#形体训练#习惯,08-17 16:57:21,12秒,--,--,50233,1297,466,Liu Fang Posture Corrector
如果你的激情能够每日如一，你的一天就等于别人的很多天，日积月累年复一年，你就成为了最优秀的??#形体训练,08-17 06:45:46,15秒,--,--,41904,796,1171,Liu Fang Posture Corrector
形体美能治愈一切，优雅气质能激活女人的青春，余生很贵，请别浪费。#形体训练#优雅#气质#青春,08-16 06:45:55,15秒,--,--,41077,897,1103,Liu Fang Posture Corrector
女人的优雅和精致，是讲究出来的，不断提升自己，连灵魂都会变得有香气。#优雅仪态#形体训练#女人,08-15 16:55:30,23秒,--,--,37778,1398,788,Liu Fang Posture Corrector
坚持是生命的一种毅力！想要破茧成蝶，必须付出千倍努力！不为别人，只为做一个连自己都羡慕的人。#形体训练,08-15 06:48:23,15秒,--,--,18278,510,516,Liu Fang Posture Corrector
世界上有两种最耀眼的事，一个是日出东方，一个是你努力的样子。#努力#形体训练#优雅仪态,08-14 16:58:59,13秒,--,--,37090,1196,365,Liu Fang Posture Corrector
小时候，幸福是一件事物；长大后，幸福是一种状态。每次进步都是幸福。七夕快乐！#七夕我想对你说  #形体训练,08-14 06:48:35,16秒,--,--,23322,687,557,Liu Fang Posture Corrector
幸福没有标准答案，快乐也不止一条途径。知足上进，保持热爱??#快乐 #生活 #舞蹈,08-13 16:58:08,25秒,--,--,84700,5281,1206,Liu Fang Posture Corrector
没有不会美的女人，只有不愿美的女人，女人之美，始于自信。#自信#女人#形体训练,08-13 06:46:40,14秒,--,--,25903,698,501,Liu Fang Posture Corrector
把优雅变成习惯，让优秀习以为常。塑造外在形体美，挖掘内在心灵美。#习惯 #优雅仪态 #形体训练,08-12 16:59:46,9秒,--,--,70835,2349,682,Liu Fang Posture Corrector
管理好自己的健康和身材，无论几岁，都是最好的年华。#身材#形体训练#健康#优雅仪态,08-12 06:48:40,16秒,--,--,25427,583,761,Liu Fang Posture Corrector
所有努力之后，必将迎来优秀。#骁气十足舞蹈挑战 #这是什么神仙古风舞#歌曲骁,08-11 16:55:49,14秒,--,--,110321,3495,1066,Liu Fang Posture Corrector
走得慢点没关系，只要坚持走，就一定离目标越来越近。加油！#坚持#目标#形体训练,08-11 06:46:28,21秒,--,--,26679,595,485,Liu Fang Posture Corrector
要努力，要有耐心，繁花锦簇，硕果累累都需要过程。#努力#形体训练#优雅仪态,08-10 17:03:50,33秒,--,--,42776,740,2238,Liu Fang Posture Corrector
用最美的姿态遇见最好的自己，形体训练不止让你收获气质的升华，还让你拥有优雅的人生。#人生#优雅#气质,08-10 06:45:39,18秒,--,--,34416,954,735,Liu Fang Posture Corrector
身材训练是这世界上最公平的事情，你付出多少就收获多少。#形体训练 #瘦 #努力 #公平,08-09 16:53:25,24秒,--,--,40731,780,3626,Liu Fang Posture Corrector
保持自律才是你最好的天赋，坚持学习才是你最大的财富。#自律#优雅仪态#形体训练,08-09 06:45:41,14秒,--,--,39528,802,1116,Liu Fang Posture Corrector
大手牵着小手，这个秋天陪你们认识更广阔的世界，希望长大后，你们的童年里装满幸福。#亲子 #成长 #记录美好童年,08-08 16:54:22,15秒,--,--,171731,5528,1090,Liu Fang Posture Corrector
有时候，我们不需要太复杂，只需要在简单的事情上扎根，扎深。#成长#自律 #形体训练,08-08 06:45:43,15秒,--,--,21794,599,483,Liu Fang Posture Corrector
亲子踢踏舞，女儿是妈妈的影子#节奏踢踏舞 #亲子,08-07 16:53:05,10秒,--,--,195811,4722,1087,Liu Fang Posture Corrector
努力的意义就是，往后的每一天都是最美的自己！加油！#努力#形体训练#女人#加油,08-07 06:46:01,15秒,--,--,33119,705,577,Liu Fang Posture Corrector
生活就是这样，有点忙，有点累，有点苦，但也有点甜。每天一杯果汁，给生活加点甜，营养又漂亮。#生活#果汁#美,08-06 16:50:42,16秒,--,--,121382,3410,1512,Liu Fang Posture Corrector
独立而不强势，自主而不自我，事要自己扛才能成长，苦要自己尝才能体会，路要自己走才能踏实#优雅仪态,08-06 06:54:23,34秒,--,--,49214,3173,1141,Liu Fang Posture Corrector
学习是天天的事，成长是渐渐的事，优秀是坚持的事，世界上所有的逆袭，全都是有备而来#形体训练#坚持#成长,08-05 16:54:48,37秒,--,--,39290,652,3405,Liu Fang Posture Corrector
形体训练是一场马拉松。它不属于某个年龄段，而是贯穿于整个人生。不为取悦别人而是宠爱自己。#形体训练 #自律,08-05 06:46:04,14秒,--,--,54582,1123,1152,Liu Fang Posture Corrector
一定要做一个独立的女人！有独立的思想，独立的经济，独立的人格！#女性成长#智慧#优雅仪态#形体训练,08-04 06:45:37,16秒,--,--,46473,900,876,Liu Fang Posture Corrector
每一个漂亮的女人都不简单，因为美丽的背后都藏着严格的自律。#自律#优雅仪态#形体训练#女人,08-03 16:53:51,26秒,--,--,29396,530,2779,Liu Fang Posture Corrector
自律是女人最好的铠甲，美丽是女人最强的资本，当你又美又忙，还哪有时间患得患失。#女人#优雅仪态#自律,08-03 06:45:33,15秒,--,--,28606,1106,1119,Liu Fang Posture Corrector
时间是我们努力的尺子，丈量着每一寸你用心的坚持和付出。#坚持#自律#优雅仪态#形体训练,08-02 16:50:55,21秒,--,--,39880,813,1538,Liu Fang Posture Corrector
女人的美，从不止一面，可性感，可阳光，可优雅，唯独不能平庸。#女人#优雅#形体训练,08-02 06:46:47,16秒,--,--,43760,1207,932,Liu Fang Posture Corrector
女人应该一生都很美，可以认真的年轻，也可以优雅的老去，如果岁月不宠你，更要深深的爱自己。#美#优雅仪态,08-01 16:50:38,30秒,--,--,67948,3110,1394,Liu Fang Posture Corrector
每次有努力的冲动，都是未来的你在像现在的你求救，不要辜负了自己。#运动#健康#优雅仪态#打造完美身材,08-01 06:48:07,15秒,--,--,28648,674,646,Liu Fang Posture Corrector
世界上从不缺努力的人，缺的是努力到底的人。#坚持#努力#形体训练#优雅仪态,07-31 16:49:41,27秒,--,--,35374,701,1656,Liu Fang Posture Corrector
女人最好的状态，就是永远走在让自己精致的路上。#精致#女人#形体训练 #优雅仪态,07-31 06:45:40,16秒,--,--,27867,677,771,Liu Fang Posture Corrector
想要最好的生活，就先让生活看到最好的自己，愿每位女人都能活成自己喜欢的样子。#生活#女人#优雅仪态#形体,07-30 16:47:02,10秒,--,--,39258,1867,546,Liu Fang Posture Corrector
只有用日复一日的汗水和坚持，才能换来镜头里光彩夺目的自己。#舞蹈#孔雀舞#零基础学舞蹈,07-30 06:45:42,13秒,--,--,154478,7688,1366,Liu Fang Posture Corrector
女孩子没有退路，只有努力让自己优秀，才能让自己变得更有底气。#形体#骨盆前倾#体态纠正,07-29 17:20:06,36秒,--,--,154923,1816,11747,Liu Fang Posture Corrector
追求美丽这件事无需鸡汤，毕竟，往后余生，气质优雅属于自己，终身受益的也是自己。#优雅仪态#气质#旗袍,07-29 06:45:39,14秒,--,--,66042,2363,610,Liu Fang Posture Corrector
所有的光芒都是坚持埋下的伏笔，请相信坚持的力量。#形体#坚持#优雅仪态,07-28 16:49:06,15秒,--,--,38460,683,592,Liu Fang Posture Corrector
从形到仪，从仪到礼，从礼到柔，从柔到态，从态到韵，从韵到心。形体仪态之美，每位女人都应该拥有。#优雅仪态,07-28 06:46:22,18秒,--,--,41849,1717,439,Liu Fang Posture Corrector
你未必出类拔萃，但一定要心有所期。你未必万里挑一，但一定要全力以赴。#舞蹈#形体#优雅仪态,07-27 16:46:36,14秒,--,--,164306,6977,1887,Liu Fang Posture Corrector
气质修炼应该是女人一辈子坚持的事情，容颜终会老去，但气质不会。没有坚持，何来美好。#气质 #优雅仪态,07-27 06:42:06,10秒,--,--,46138,1927,373,Liu Fang Posture Corrector
每个优美的瞬间都曾被平庸千锤百炼，请相信，努力可以让一个人闪闪发亮。#舞蹈#彩云之南#优雅仪态,07-26 16:49:42,23秒,--,--,365610,20609,5657,Liu Fang Posture Corrector
姐妹们，最贵的地皮不是北京上海，而是你自己，请抓住有限的时光，让自己绽放美丽。#女人#美#形体,07-26 06:49:30,14秒,--,--,32438,664,733,Liu Fang Posture Corrector
女人，生命的每个阶段都应该坚持瘦身，保持美丽。你若偏要发光，定无人可挡。#自律#瘦#优雅仪态,07-25 16:50:02,15秒,--,--,22939,484,679,Liu Fang Posture Corrector
时光匆匆，转眼间小小少年初长成，成为我的小王子，以后换你来守护妈妈[爱心][爱心]#成长#守护#母子,07-25 06:49:39,25秒,--,--,86847,4988,823,Liu Fang Posture Corrector
女人对美的追求不是天性，是对生活的尊重，所以，女人任何时候都要自信精致。#女人#美#优雅仪态,07-24 06:50:12,14秒,--,--,44668,1763,355,Liu Fang Posture Corrector
在大自然里面我们很渺小，但只要我们大家汇聚爱的力量，即可克服一切困难，河南加油！#河南暴雨#河南加油,07-23 17:59:34,24秒,--,--,303309,18725,4422,Liu Fang Posture Corrector
从容优雅，一半来自阅历和价值，一半来自自律和形象。与其仰望别人，不如改变自己。#形象#舞蹈#优雅仪态,07-23 06:50:40,11秒,--,--,50077,1722,479,Liu Fang Posture Corrector
女人最好看的样子，就是当下最美丽自信的自己。#女人#自信#成长#优雅仪态,07-22 16:49:30,13秒,--,--,60543,2362,546,Liu Fang Posture Corrector
停止羡慕别人，学会打造自己，做一个爱自己且对自己有要求的女人，创造属于自己的美。#女人#美#优雅仪态,07-22 06:53:14,14秒,--,--,26507,714,596,Liu Fang Posture Corrector
历尽繁华，看遍世间，你就会发现，你自信的笑容才是最美的风景。#美#自信#优雅仪态,07-21 16:49:30,15秒,--,--,52281,2655,469,Liu Fang Posture Corrector
一个女人光鲜靓丽，气质优雅的样子，应该是闪闪发光的，因为美丽是女人最大的财富。#女人#财富#优雅仪态,07-21 06:58:29,15秒,--,--,34132,2963,1061,Liu Fang Posture Corrector
当你依靠形象，气质，心境和阅历赢得尊重的时候，你会懂得努力让自己变得优秀有多重要。#努力#气质#形象,07-20 16:58:29,14秒,--,--,28579,856,537,Liu Fang Posture Corrector
女人的魅力不在于年龄和美貌，而在于你有没有坚持学习和努力成长。#成长#学习#优雅仪态,07-20 06:58:45,17秒,--,--,20438,478,450,Liu Fang Posture Corrector
想要的东西，要靠自己的努力去得到，唯有自强不息，才有未来的无限可能。#努力#形体训练#优雅仪态,07-19 16:58:03,15秒,--,--,24788,573,802,Liu Fang Posture Corrector
外修形而雅，内修识而谦。人生的意义在于追求丰富自己，提高自己，完善自己。#学习#成长#优雅仪态,07-19 06:58:38,15秒,--,--,22072,486,681,Liu Fang Posture Corrector
生活再忙碌，也要记得好好保养，认真减肥，努力自律，成为最好的自己。#自律#减肥#优雅仪态,07-18 17:00:20,16秒,--,--,27632,650,796,Liu Fang Posture Corrector
疲倦的生活里总要有些温柔，把生活放进花瓶里，从此生活有了诗意，花朵里也有了生活。#插花#生活,07-18 11:59:44,14秒,--,--,51495,1374,760,Liu Fang Posture Corrector
勤勤恳恳瘦身，认认真真保养，是你对每一段岁月里的自己最大的肯定和热爱。#保养#热爱#优雅仪态,07-18 06:58:46,13秒,--,--,23540,515,616,Liu Fang Posture Corrector
一个女人漂亮，有气质，都源于爱自己，优秀的人生没有借口，只有足够热爱的心。#优雅仪态#气质,07-17 16:58:15,15秒,--,--,27653,781,684,Liu Fang Posture Corrector
万千姿态始于#形体 百般姿色终于仪态，要爱自己，不要等秋天来了才想起弥补夏天的遗憾。#优雅仪态,07-17 06:59:06,16秒,--,--,25146,606,514,Liu Fang Posture Corrector
努力和结果中间隔着坚持，一步一个脚印，日积月累，终能遇见最好的自己。#努力#坚持#优雅仪态,07-16 16:58:28,15秒,--,--,23186,614,619,Liu Fang Posture Corrector
余生，请做一个花心的女人，花时间在身材上，花心思在容貌上，花精力在学习上。#优雅仪态#形体训练,07-15 16:58:46,14秒,--,--,29124,744,850,Liu Fang Posture Corrector
姐妹们，坚持保养不是为了改变时光，而是为了不让时光改变我们。#坚持#改变#优雅仪态,07-15 06:58:51,15秒,--,--,86519,1932,1780,Liu Fang Posture Corrector
身材不会一夜变胖，减肥不会一刻见效，你需要默默重复，让岁月无痕。#减肥#自律#优雅仪态,07-14 16:58:53,15秒,--,--,33462,800,1051,Liu Fang Posture Corrector
女人，不要沉溺在安逸里得过且过，要管理好自己的身材，努力让自己变强大，生活才会变美好。#形体训练,07-14 06:58:40,14秒,--,--,31856,915,946,Liu Fang Posture Corrector
相信相信的力量，努力就会有收获。心中充满阳光，生活才会充满希望。#阳光#希望#优雅仪态,07-13 16:59:05,15秒,--,--,24923,601,463,Liu Fang Posture Corrector
“娴静犹如花照水，行动好比风拂柳”女子应该如此，温文尔雅，优雅大气。#优雅仪态#气质女神,07-13 06:58:37,12秒,--,--,28070,731,417,Liu Fang Posture Corrector
身材管理这件事不需要什么鸡汤，低头看不到脚是鸡汤，喜欢却穿不上的衣服也是鸡汤。#身材#优雅仪态,07-12 16:58:35,14秒,--,--,24771,598,702,Liu Fang Posture Corrector
颜值是一种话语权，认真保养，好好减肥，变美这件事，等等就老了。#变美#保养#优雅仪态,07-12 06:58:42,16秒,--,--,30942,704,864,Liu Fang Posture Corrector
减肥需要全力以赴，但不能太过着急，生命从来不是一个结果，而是努力的过程。#优雅仪态#形体训练,07-11 16:58:28,13秒,--,--,53683,913,1566,Liu Fang Posture Corrector
女人如花，想要美得惊艳，就要像插花一样，删繁就简，留住最想要的精髓就好#插花#女人#美,07-11 11:59:43,23秒,--,--,183165,4015,4549,Liu Fang Posture Corrector
女人一定要健康，一定要漂亮，当你身材好，气质好的时候，你想要的一切都会慢慢靠近。#身材#气质#优雅仪态,07-11 06:58:57,16秒,--,--,39862,1373,910,Liu Fang Posture Corrector
人生路长，要怀揣希望，要一直努力，剩下的交给时间。相信你想要的都会在不经意间统统拥有#努力 #优雅仪态,07-10 16:58:19,17秒,--,--,46723,944,991,Liu Fang Posture Corrector
不要期待会有突如其来的好运，只愿付出的努力都能有回报，愿每个认真努力的现在，都有一个水到渠成未来。#努力,07-10 06:58:39,15秒,--,--,22114,522,542,Liu Fang Posture Corrector
女人一定要好好经营自己，穿的漂亮是魅力，活得漂亮才是价值。#女人#价值#优雅仪态,07-09 16:59:24,14秒,--,--,48404,986,825,Liu Fang Posture Corrector
所有逆袭都是有备而来，所有幸运都是努力埋下的伏笔。#身材#变美#优雅仪态,07-09 06:58:42,16秒,--,--,60643,1254,1061,Liu Fang Posture Corrector
努力练习吧，姐妹们，你的人生里不只有柴米油盐，还有瘦下来蜕变后闪耀的自己。#蜕变#瘦#优雅仪态,07-08 16:59:58,15秒,--,--,59793,1192,1241,Liu Fang Posture Corrector
如果上天没有给你美貌，那就用气质来超越美貌，如果你已经拥有了美貌，那就用气质来超越时光。#气质,07-08 06:58:34,16秒,--,--,60936,1298,1230,Liu Fang Posture Corrector
三十怎样，四十又何妨，一岁有一岁的味道，一天有一天的风景。只要没有放弃美丽，就会一直绽放魅力#优雅仪态,07-07 06:58:41,19秒,--,--,60523,1763,963,Liu Fang Posture Corrector
值得拥有的东西，永远都来之不易，一直坚持的东西，总有一天会回报你。#坚持#成长#优雅仪态,07-06 16:59:19,16秒,--,--,37959,934,611,Liu Fang Posture Corrector
人生没有白走的路，好运往往藏在努力中，我们不能放弃希望，不能停止努力。#努力#坚持#优雅仪态,07-06 06:58:40,15秒,--,--,84523,1818,1877,Liu Fang Posture Corrector
泉水之所以能穿石，是因为它一直在努力。姐妹们，你努力瘦下来的样子，真的很美。#努力#优雅仪态,07-05 06:58:48,16秒,--,--,61211,1509,1465,Liu Fang Posture Corrector
每一次改变都是礼物，每一次坚持都是成长。人生是用来改变的，乾坤未定，你我皆是黑马。#成长#改变#优雅仪态,07-04 16:58:27,13秒,--,--,51503,946,862,Liu Fang Posture Corrector
并不是因为足够完美了，才值得你坚持，而是你坚持了，才会变得足够完美。#美丽#坚持#优雅仪态,07-04 06:58:40,17秒,--,--,27509,766,674,Liu Fang Posture Corrector
眼睛是心灵的窗户，灵动的眼神会成为你建立人格魅力的法宝。#眼神#魅力#优雅仪态,07-03 17:02:59,16秒,--,--,49112,1038,637,Liu Fang Posture Corrector
所有的成功，看似在一夜之间爆发，其实都是靠日积月累，有条不紊，持之以恒去完善和精进的。#成功#坚持#优雅仪态,07-03 06:59:07,15秒,--,--,53970,1050,1185,Liu Fang Posture Corrector
胖就积极减肥，皮肤不好就好好护肤，五官改变不了就改变气质，能力不够就去学习，永远不要停止美好。#气质,07-02 16:58:25,14秒,--,--,47862,1081,1042,Liu Fang Posture Corrector
世界上最美的际遇，遇见一个更优秀的自己，不忘初衷，方得始终。#成长#努力#优雅仪态,07-02 06:58:43,16秒,--,--,27196,755,606,Liu Fang Posture Corrector
那些看似不起波澜的日复一日，一定会在某一天让你看到坚持的意义。#自律#减肥#优雅仪态,07-01 16:59:21,18秒,--,--,114347,2106,4011,Liu Fang Posture Corrector
买个水果都要挑好看的，为什么对自己就没有要求？你的形象价值千金，身材气质都是增值资产#形象,07-01 07:59:19,18秒,--,--,52937,1166,1151,Liu Fang Posture Corrector
生于华夏，何其荣幸。#建党百年 愿祖国繁荣昌盛。我爱你中国??#一句誓言跨越百年,07-01 06:59:55,24秒,--,--,83892,89,1166,Liu Fang Posture Corrector
