Video_content,Release_time,The_video_duration,Estimated_Sales_volume_(pieces),Estimated_sales_amount,Number_of_likes,Number_of_comments,Number_of_reposts,Name
宝宝我们终于要见面了～,07-27 15:58:44,9秒,--,--,147163,8446,1154,Chen SanfeiGG
三天不见老婆，真的太想她了??今天下午6点直播哦,07-26 14:30:37,13秒,--,--,180651,6474,983,Chen SanfeiGG
大雨无情 但人间有情 看到大家团结一心 互帮互助 心想自己生长的土地真好！河南挺住 你的身后有我们！,07-25 16:55:57,10秒,--,--,279294,6392,2347,Chen SanfeiGG
从8台加到12台物资车 已经安全抵达河南周口扶沟安置点！,07-25 13:37:58,32秒,--,--,294417,13188,1854,Chen SanfeiGG
现在出发，卸货！从8车加到了12车，希望河南早日度过难关??,07-25 11:12:19,16秒,--,--,250451,7201,1458,Chen SanfeiGG
从白天到黑夜，十几个小时的路程，我们终于到达河南周口扶沟了??,07-24 23:30:33,26秒,--,--,1030565,37907,5243,Chen SanfeiGG
连夜终于装好11车泡面和牛奶 现在马上出发要把物资送到第一线 身为中国人 不管身在何方 国人有难 我必达！,07-24 12:15:38,23秒,--,--,2994452,102188,31427,Chen SanfeiGG
我们开了三个多小时车 终于到达江苏无锡仓库了 连夜装货明天一大早出发河南！,07-24 00:19:40,24秒,--,--,1465339,49875,5244,Chen SanfeiGG
我们一家人很普通 希望能尽我们的能力为河南出一份力！,07-23 20:18:08,32秒,--,--,1418184,46312,4397,Chen SanfeiGG
都关心我生了没有，今天我来给大家报喜了……,07-22 20:30:37,18秒,--,--,608054,34106,466,Chen SanfeiGG
孕40周?1  我的小宝贝预产期都过了还不出来 你爸爸妈妈爷爷奶奶 还有很多叔叔阿姨都等着急了 今晚就出来见个面吧！,07-22 18:16:23,7秒,--,--,213562,17413,425,Chen SanfeiGG
预产期超1天，宝宝还不出来……,07-22 17:10:28,12秒,--,--,329152,26592,1309,Chen SanfeiGG
我要生了，老公的真实反应……,07-22 16:10:52,24秒,--,--,478825,8469,5966,Chen SanfeiGG
头胎40周 婆婆备好鸡 公公备好利是?? 老公备好待产包 弟弟备好医生 月嫂阿姨排队等你 我多爬爬楼梯 晚上你就生行不？,07-21 18:28:02,12秒,--,--,258472,22106,521,Chen SanfeiGG
宝宝差点没了……,07-21 17:18:37,12秒,--,--,803467,13988,7048,Chen SanfeiGG
快生了医生让我每天数胎动 我也不会数 只能这样了……,07-21 16:41:28,33秒,--,--,196287,8436,2699,Chen SanfeiGG
河南加油！你们一定要挺住！#河南暴雨互助,07-21 14:42:14,6秒,--,--,524712,39797,7685,Chen SanfeiGG
今天就是预产期了 我的宝你快点退房吧 我长这么大居然还要尿床都是因为你啊！,07-21 13:52:16,15秒,--,--,334433,17077,493,Chen SanfeiGG
预产期最后一天 公公婆婆老公 带我入住月子中心随时待产了！准备迎接7月的牛宝宝??,07-20 13:58:23,9秒,--,--,492584,18691,685,Chen SanfeiGG
39周?5依然不发动 产检医生说了句意味深长的话 我的宝啊 越来越期待你的到来了 不要让你妈猜了 我希望你今晚就生！,07-20 12:02:29,24秒,--,--,298110,34971,474,Chen SanfeiGG
39周?5 感觉随时都要生了 头胎有点紧张怕发动的时候不知道怎么办 提前到月子中心了！下午6点直播哦,07-20 09:57:43,10秒,--,--,380104,19153,641,Chen SanfeiGG
产房已经准备好了，随时等宝宝发动，公婆为我准备好了一切！真幸福??#孕晚期,07-18 17:18:56,18秒,--,--,970832,28440,2481,Chen SanfeiGG
39周+3 今天来医院熟悉下生产流程 试下产床 不然都不知道怎么躺 随时准备待产了！,07-18 15:00:10,10秒,--,--,676954,31214,1075,Chen SanfeiGG
听我一句劝 别 怀 孕！??,07-17 13:29:47,7秒,--,--,361190,6033,4364,Chen SanfeiGG
快要生了 医生天天让我数胎动 问题是我也不会数啊 只知道这两天他不怎么动了 这样是正常的啊？,07-16 17:30:48,19秒,--,--,138062,15315,179,Chen SanfeiGG
宝宝，你爸爸已经迫不及待的想见你了??,07-16 15:54:01,22秒,--,--,158963,4968,1460,Chen SanfeiGG
不好意思了宝宝 实在太烫了 以后出来妈妈好好补偿你??,07-15 16:36:36,9秒,--,--,353640,5201,3374,Chen SanfeiGG
预产期最后6天，还不出来，天天晚上憋尿醒，耻骨疼醒 ，再不出来我都想刨腹产了??,07-15 14:10:04,10秒,--,--,154491,9981,378,Chen SanfeiGG
坐了十几个小时的高铁终于到了 耻骨疼的要命 今晚就不直播了！明天晚八点不见不散～,07-14 21:00:10,9秒,--,--,253645,11289,1319,Chen SanfeiGG
怎样拿走老公的工资？别说我没教你呀！,07-14 14:34:48,16秒,--,--,398291,4540,7746,Chen SanfeiGG
我要离开广西了……,07-13 17:59:49,29秒,--,--,153237,3554,962,Chen SanfeiGG
穿裤子穿裙子的都一样，坐等8天后宝宝出生～,07-13 15:39:23,17秒,--,--,173972,8376,1661,Chen SanfeiGG
千万不要相信一个孕妇说下楼扔垃圾 因为你永远不知道她要干什么 这点小心思被我识破了！,07-13 13:35:29,16秒,--,--,274296,10152,1784,Chen SanfeiGG
切生日蛋糕，也要有仪式感！哈哈??祝老公生日快乐??！今晚8点纸播哦,07-12 18:35:31,21秒,--,--,323271,3680,14502,Chen SanfeiGG
宣布个大事，我要回杭州生宝宝了……,07-12 10:31:04,31秒,--,--,128720,4483,846,Chen SanfeiGG
男主角登场了，今天我给老公当司机，弟弟妹妹给当保镖，老公生日最大，已经到达现场了，中午12点准时开播,07-12 07:01:21,10秒,--,--,176729,6176,1487,Chen SanfeiGG
96年嫁96年 广西嫁广西 在一起从未红过脸，当初什么都不图只图对我好，马上迎来我们第一个宝宝啦,07-11 12:13:41,8秒,--,--,391971,6343,2324,Chen SanfeiGG
转眼回广西一个月了，今天刚给我的员工发完工资，100多w，有压力才有动力??,07-10 16:20:07,41秒,--,--,113765,3253,1051,Chen SanfeiGG
被弟媳宠坏了……,07-06 16:09:50,14秒,--,--,321062,7576,1842,Chen SanfeiGG
这儿媳妇太坑人了……,07-04 17:21:20,40秒,--,--,370893,3895,4931,Chen SanfeiGG
为什么我婆婆做的到 我做不到？哪个步骤错了？,07-04 16:27:08,11秒,--,--,224149,3379,1911,Chen SanfeiGG
关于我的收入，作为96年广西女孩，做到这个成绩我还是很满意的，唯一缺点就是不稳定……,07-03 17:50:07,24秒,--,--,255450,7807,6252,Chen SanfeiGG
从2014-2021 很庆幸身边一直是你 不离不弃 无论贫穷还是富裕！#我们的七年,07-02 12:22:05,56秒,--,--,516174,12522,4616,Chen SanfeiGG
在一起的第七年，今天我们要订婚了，感谢大家的祝福！中午12点准时开播哦！#订婚快乐,07-02 09:00:32,16秒,--,--,129405,5724,1311,Chen SanfeiGG
大猪蹄来了，从此我多了一个身份 未婚妻 希望每个女孩都能嫁给爱情 ??  #订婚,07-02 07:59:52,15秒,--,--,142647,5085,1103,Chen SanfeiGG
7.2号中午12点，我们就要订婚了，初中是你 ，初恋也是你，到现在身边的还是你，真是便宜了你#订婚,07-01 16:43:32,11秒,--,--,133033,3123,1315,Chen SanfeiGG
谢谢您10年前一个人把我养大，我最爱的母亲，您女儿长大了，再也不需要让您每天打两份工了，以后我养您,06-30 20:55:57,9秒,--,--,212866,2865,976,Chen SanfeiGG
曾经趴在车窗边偷看新娘的小女孩 7.2号也要订婚了???♂? 没想到这天来的这么快！,06-29 20:54:35,8秒,--,--,205468,3656,1137,Chen SanfeiGG
马上就到订婚的日子 试了一天礼服了 我到底穿哪套好看啊 大家给点建议吧,06-29 19:32:33,13秒,--,--,280464,44513,1264,Chen SanfeiGG
98年虎 今天被求婚 没驾照 车2辆 房子5套 存款100万 即使每天还要拼命工作 依然觉得未来可期 加油！,06-26 21:00:41,16秒,--,--,146854,3445,714,Chen SanfeiGG
2012－2021??,06-26 17:00:23,9秒,--,--,173673,4394,584,Chen SanfeiGG
人生中的第一套房 不是自己买的 不是老公买的 是婆婆送的 感恩遇到一个好婆婆??,06-26 16:28:34,7秒,--,--,139325,5555,636,Chen SanfeiGG
这婆婆太霸气了，儿子求婚，她居然给儿媳妇送了一套房……,06-26 10:58:15,9秒,--,--,159608,3350,381,Chen SanfeiGG
喜欢了七年的男孩子，今天他终于要向我求婚了??,06-26 09:00:46,17秒,--,--,145155,4172,516,Chen SanfeiGG
闺蜜团已到位 中午12点直播间见！,06-26 08:00:16,8秒,--,--,215240,3644,967,Chen SanfeiGG
这弟弟太霸气了 准备了999朵玫瑰花 今天中午12点求婚 我都羡慕了……,06-26 04:56:56,7秒,--,--,153698,2104,572,Chen SanfeiGG
26号中午12点，带着我的男团穿成这样去求婚，你们说会成功么？,06-25 09:58:06,12秒,--,--,114310,5184,1002,Chen SanfeiGG
我们今天正式搬家了……,06-21 10:31:02,27秒,--,--,214074,3600,507,Chen SanfeiGG
今天是我在广西，第一套房子的乔迁之喜，全家人都到了，谢谢老公布置的仪式感，中午12点直播哦,06-21 07:57:25,11秒,--,--,186334,3924,626,Chen SanfeiGG
今天搬新家了，大吉大利！中午12点 直播哦,06-21 06:59:00,18秒,--,--,213195,3471,4092,Chen SanfeiGG
这么多年在我的印象中，姐夫一直不是个很浪漫的人。今天浪不浪漫先不说，反正我感觉有点帅……,06-17 18:58:37,21秒,--,--,397328,10744,2083,Chen SanfeiGG
公主的鞠躬礼仪 只想献给我的2700w粉丝 感谢你们??,06-17 15:17:18,8秒,--,--,136111,55,471,Chen SanfeiGG
今天是我的生日，大家可以给我一个祝福吗？,06-17 12:10:14,8秒,--,--,305207,12946,1035,Chen SanfeiGG
女主角登场了，今天我给老婆当司机，爸爸妈妈给当保镖，老婆今天生日最大，已经到达现场了，中午12点准时开播,06-17 09:59:34,11秒,--,--,200032,7760,611,Chen SanfeiGG
生日倒计时最后1天，老公为了我17号的生日，已经好几天没有回家了，今天偷偷来给他一个惊喜??,06-16 15:30:20,10秒,--,--,114828,3634,432,Chen SanfeiGG
6.17号就是我的生日了 没想到老公这么重视 找到这样的老公 真的睡觉都要笑醒了！ #魔性摇摆头,06-15 15:49:56,7秒,--,--,227734,6367,831,Chen SanfeiGG
#端午道安康 这个游戏不建议孕妈玩！我投降 我认输！玩了几十遍终于还是……没过！,06-14 14:24:17,17秒,--,--,126951,1539,484,Chen SanfeiGG
奶奶知道我孕晚期，特意大老远给我带来她养的老母鸡和蛋，明知道我什么都不缺，但总想把最好给我，瞬间泪奔了#奶奶,06-13 18:37:14,12秒,--,--,317055,4256,467,Chen SanfeiGG
第一次带老公回娘家，自从老公知道这些田地都是我的之后，感觉整个人都飘了……,06-13 16:34:35,13秒,--,--,110138,1854,312,Chen SanfeiGG
和老公的第一套房子 以后这个就是我们的小窝了??,06-12 20:20:53,29秒,--,--,131993,3818,680,Chen SanfeiGG
把一家人聚在一起 就是最大的幸福??,06-12 19:16:08,44秒,--,--,164592,5735,763,Chen SanfeiGG
我不想在家种田 我要到大城市当老板……,06-12 16:39:08,12秒,--,--,178648,2381,746,Chen SanfeiGG
婆婆送我的房子，终于装修好了，感恩遇到这么好的公婆??,06-11 18:53:19,34秒,--,--,192337,5012,663,Chen SanfeiGG
从杭州到广西老家，1000多公里，一回到家就看到，丈母娘提前把卫生都弄好了，还准备好了丰盛的饭菜，满满的爱??,06-10 18:27:10,12秒,--,--,132779,1445,311,Chen SanfeiGG
还好有老爸 不然我麻烦就大了……,06-08 18:26:07,16秒,--,--,333356,3530,1054,Chen SanfeiGG
你对我好 我心里都知道 感恩遇到好婆婆??,06-08 16:51:50,13秒,--,--,274108,5703,1428,Chen SanfeiGG
出门居然碰到抢包的，还好我机智，一定要看到最后??,06-08 16:06:31,17秒,--,--,110906,1703,571,Chen SanfeiGG
马上给员工发工资了，差不多120w，有压力才有动力，我会继续加油的！,06-07 20:05:48,44秒,--,--,138279,4717,1112,Chen SanfeiGG
好久没有和弟媳一起跳舞了，还有一个月多月我就要生了，希望把好运传给她，哈哈……??,06-05 21:01:37,16秒,--,--,193285,4708,595,Chen SanfeiGG
我妈催我结婚了……,06-05 20:30:14,30秒,--,--,166405,4333,356,Chen SanfeiGG
老爸真是害人害己啊……,06-04 16:18:07,42秒,--,--,174515,2561,2608,Chen SanfeiGG
不是我衣品差，是怀孕后真的很难买衣服……??,06-03 18:15:09,32秒,--,--,131162,17925,492,Chen SanfeiGG
很多人想看孕妇化妆，今天满足一下大家……,06-02 09:00:54,47秒,--,--,167760,14659,971,Chen SanfeiGG
,,,,,,,,
能来我这个仓库我真的太荣幸，今天来的帅锅真的人超好，小细节太棒了太暖了#明星,08-29 19:47:55,13秒,--,--,41845,2956,391,Rainbow Couple
不得不改变频率了，竞争太激烈了，必须增加次数了，谢谢理解#直播,08-29 19:40:59,44秒,--,--,52291,5710,715,Rainbow Couple
真的又好气又好笑，你们太有才了，这届粉丝太难带#搞笑 #沙雕,08-29 19:24:59,25秒,--,--,88074,8176,2311,Rainbow Couple
不要观望，也不要笑话别人，自己也试一试，加油#感谢抖音,08-29 11:57:03,1分54秒,--,--,168314,16494,47843,Rainbow Couple
虽然很少带他，但他每次看到我都是笑嘻嘻的，好奇怪#宝贝,08-29 11:48:42,18秒,--,--,16892,621,65,Rainbow Couple
我们的经历还在不断更新，一路走来，经历了太多，还好彼此不离不弃#夫妻 #感恩,08-29 11:30:07,2分8秒,--,--,22279,1439,1209,Rainbow Couple
好开心认识了不少人，不过都比我好看，走出去才发现真的好多美女啊，以后还是不出去了,08-29 11:03:03,16秒,--,--,16463,833,83,Rainbow Couple
突然觉得没有信心，心里没底，但是去弄有来不及了，哎，好方#披荆斩棘的哥哥,08-29 10:54:26,31秒,--,--,52128,3060,540,Rainbow Couple
机场一碗面25元，泡面10元，她纠结了一下，选了泡面，吃得香#老婆,08-27 22:07:38,14秒,--,--,29570,2891,138,Rainbow Couple
深夜放毒，哈哈，吃了继续干活！,08-26 00:41:51,25秒,--,--,11931,1200,96,Rainbow Couple
看了大家的评论，弟媳从昨天到今天对自己都开始怀疑了，哈哈哈哈哈#搞笑,08-25 18:26:31,23秒,--,--,13551,1071,97,Rainbow Couple
时间过得好快，6个月了，19斤多了，健康平安就好,08-24 20:05:38,20秒,--,--,12357,2571,83,Rainbow Couple
要学会自己爱自己,08-24 20:04:50,19秒,--,--,24171,1885,440,Rainbow Couple
阿姨也很幽默，哈哈，遇到一个好的阿姨真的太省心了，孩子交给她放心,08-24 19:56:35,29秒,--,--,44621,1268,480,Rainbow Couple
真是不敢前进又不得不想办法了，但是前方也不知道是路还是悬崖,08-24 19:24:53,46秒,--,--,28883,2312,408,Rainbow Couple
我们这一辈不努力，下一辈就要吃我们一样的苦，甚至更苦，所以，一起加油吧#抖in宝贝计划 #宝贝安心开学季,08-24 19:18:59,1分2秒,--,--,26392,1125,1338,Rainbow Couple
谢谢你们给我的力量和勇气，都说看我直播需要勇气，看来我们都是勇敢的人，哈哈,08-23 17:58:26,20秒,--,--,70748,6222,468,Rainbow Couple
大自然的搬运工#日常vlog,08-22 21:36:55,14秒,--,--,9225,2819,74,Rainbow Couple
其实我都知道，我真的很抱歉，辣眼睛了，这个打基础的阶段，我必须扛过去#抖音818新潮好物节,08-18 18:45:32,42秒,--,--,52148,6564,779,Rainbow Couple
无论你们怎么笑话我，我都不会退缩，我就是在这样的环境成长起来的，给我点时间，我不会让你们失望,08-18 18:25:47,1分5秒,--,--,109044,36695,969,Rainbow Couple
做任何事都在寻找一个平衡点，我有自知之明，所以不断的逼着自己往前爬#抖音818新潮好物节,08-18 16:09:54,8秒,--,--,50954,2375,410,Rainbow Couple
当时其实也没觉得苦，觉得正常，习惯了。但现在想想，都不知道怎么过来的，庆幸的是身边一路都是彼此,08-18 14:10:51,8秒,--,--,34448,1494,278,Rainbow Couple
临时决定818播，然后只能加班通宵#抖音818新潮好物节,08-18 01:49:31,21秒,--,--,15437,2362,139,Rainbow Couple
妈妈上半辈子真的付出了太多，最对不起的就是她#抖音818新潮好物节,08-15 09:54:30,1分15秒,--,--,85810,5245,514,Rainbow Couple
最怕的是对未来没有规划，心里发慌#抖音818新潮好物节,08-15 09:44:01,49秒,--,--,24905,2975,326,Rainbow Couple
爱自己也是一种能力，愿所有人都学会爱自己#抖音818新潮好物节,08-15 09:24:39,1分7秒,--,--,56134,4502,825,Rainbow Couple
久等了，老老小小#抖音818新潮好物节,08-15 09:17:33,8秒,--,--,21486,802,165,Rainbow Couple
你们赋予我能量，我会努力，硬着头皮上#抖音818新潮好物节,08-15 09:08:17,1分20秒,--,--,110716,7962,4136,Rainbow Couple
不到6个月，体重再创新高，19斤，但是还不长牙齿#抖音818新潮好物节,08-14 19:46:07,36秒,--,--,15810,3165,104,Rainbow Couple
这是每天最放松最开心的时刻，陪孩子的时间太少了，我知道未来会后悔，但似乎没有办法，哎,08-13 19:03:49,11秒,--,--,30374,1432,168,Rainbow Couple
每天都在选都在吃，在这样下去我又要胖#抖音818新潮好物节,08-13 14:25:49,37秒,--,--,20408,3868,285,Rainbow Couple
凡事让一让，退一步海阔天空，但是既然耗了这么久了，又自己退让了，白耗了，对方还更嚣张的样子,08-12 21:44:03,16秒,--,--,42445,2722,180,Rainbow Couple
真的是第一次遇到这种情况，我老公第一次在外面这么冲，两边都劝不动，怎么办,08-12 18:26:03,44秒,--,--,60806,3904,350,Rainbow Couple
这么多人又要误会我了，关于这种我真的不知道怎么办，都想直接给你们发出，不让你们误会，但都不知道该找谁,08-09 21:52:38,55秒,--,--,17390,3606,310,Rainbow Couple
#抖音818新潮好物节 那天陪我们破亿到最后的，记得来,08-08 18:55:02,5秒,--,--,13159,2285,188,Rainbow Couple
一家人住一起快一年了，弥补了前30年各奔东西的打工，无法陪在身边的遗憾，谢谢你们#感恩,08-08 11:44:27,43秒,--,--,64102,5350,871,Rainbow Couple
其实平时怎么嘲笑我都没事，但是看到嘉宾被骂，心里还是有点难过，对方看到肯定都后悔来，不过我会努力的,08-08 11:13:57,34秒,--,--,46945,17456,501,Rainbow Couple
答应的我会做到，真的很抱歉。其实我老公也不是故意，他不太会表达，没有恶意#感恩,08-08 09:18:30,52秒,--,--,18972,1932,212,Rainbow Couple
中途好几次想放弃，还好坚持了。真的谢谢你们的信任，陪伴与见证，我何德何能#感恩,08-08 08:56:15,23秒,--,--,82385,4374,1528,Rainbow Couple
上一场下播的时候让大家失望了，我说过，会给你们补上,08-07 21:29:16,6秒,--,--,12862,3120,109,Rainbow Couple
真的不是故意，哎，让陪我到最后的粉丝们失望了，抱歉#对不起,08-04 03:24:00,1分23秒,--,--,21146,6087,158,Rainbow Couple
科科真的很高，我身高1米8，他比我还高很多#8月3日中午12点彩虹生日破亿大场 #抖音818新潮好物节,08-03 19:42:06,19秒,--,--,36210,3708,2318,Rainbow Couple
本人真的超帅超立体超高#8月3日中午12点彩虹生日破亿大场 #抖音818新潮好物节,08-03 19:37:49,12秒,--,--,8378,977,216,Rainbow Couple
从未想过生日他能来，感恩#8月3日中午12点彩虹生日破亿大场 #抖音818新潮好物节,08-03 19:31:06,20秒,--,--,18348,1929,482,Rainbow Couple
好帅啊#8月3日中午12点彩虹生日破亿大场,08-03 17:23:31,1分53秒,--,--,13245,1707,472,Rainbow Couple
彩虹好激动啊,08-03 17:17:08,11秒,--,--,31627,2169,751,Rainbow Couple
科科来啦#抖音818新潮好物节 #8月3日中午12点彩虹生日破亿大场,08-03 16:37:40,16秒,--,--,9615,1147,138,Rainbow Couple
#8月3日中午12点彩虹生日破亿大场 #抖音818新潮好物节,08-03 11:57:01,9秒,--,--,46187,4943,363,Rainbow Couple
回到古时候，我的舞蹈肯定惊艳皇上#8月3日中午12点彩虹生日破亿大场 #抖音818新潮好物节,08-03 11:53:18,20秒,--,--,40084,3681,270,Rainbow Couple
我是个穿越，哈哈#8月3日中午12点彩虹生日破亿大场 #抖音818新潮好物节,08-03 11:51:22,9秒,--,--,22060,1767,277,Rainbow Couple
希望所有看到的人都平安健康#8月3日中午12点彩虹生日破亿大场 #抖音818新潮好物节,08-03 11:50:23,19秒,--,--,24318,619,722,Rainbow Couple
从小女孩到大女人#8月3日中午12点彩虹生日破亿大场 #抖音818新潮好物节,08-03 11:48:18,6秒,--,--,9897,1279,72,Rainbow Couple
自创新发型，你们感觉如何#8月3日中午12点彩虹生日破亿大场 #抖音818新潮好物节,08-03 11:20:11,1分14秒,--,--,16633,3945,675,Rainbow Couple
终于不怕过生日了，因为爱的人都在身边了#8月3日中午12点彩虹生日破亿大场 #抖音818新潮好物节,08-03 10:57:53,15秒,--,--,8126,443,144,Rainbow Couple
曾经说我嘴巴大的人，好好看看！#8月3日中午12点彩虹生日破亿大场 #抖音818新潮好物节,08-03 10:49:50,23秒,--,--,108876,8525,1125,Rainbow Couple
能让爱的人都在身边，真的感恩大家的支持与信任#8月3日中午12点彩虹生日破亿大场 #抖音818新潮好物节,08-03 09:59:52,27秒,--,--,14488,1118,86,Rainbow Couple
5个多月，18.5斤，妈妈已经追奶成功，终于又基本够吃了#8月3日中午12点彩虹生日破亿大场,08-03 09:25:41,11秒,--,--,57008,8044,668,Rainbow Couple
31岁，终于，爱的人都环绕身边#8月3日中午12点彩虹生日破亿大场 #抖音818新潮好物节,08-03 08:09:05,20秒,--,--,7280,659,80,Rainbow Couple
5个小时没吸，一次就吸了240毫升，算多吧#8月3日中午12点彩虹生日破亿大场 #抖音818新潮好物节,08-03 02:42:09,9秒,--,--,28943,3889,167,Rainbow Couple
是他是他就是他，我们的朋友，小科科#8月3日中午12点彩虹生日破亿大场 #抖音818新潮好物节,08-02 22:32:03,22秒,--,--,15983,1461,316,Rainbow Couple
剪个头发儿子竟然不认识我了#8月3日中午12点彩虹生日破亿大场 #抖音818新潮好物节,08-02 21:27:23,13秒,--,--,24116,2056,175,Rainbow Couple
突然特别紧张，临时决定来租礼服，哪件更好？#8月3日中午12点彩虹生日破亿大场 #抖音818新潮好物节,08-02 20:12:26,31秒,--,--,34939,23864,377,Rainbow Couple
感觉整个头轻了很多很多，期待生日#8月3日中午12点彩虹生日破亿大场 #抖音818新潮好物节,08-02 17:29:57,8秒,--,--,45703,14855,538,Rainbow Couple
感觉如何？我自己看不出来#8月3日中午12点彩虹生日破亿大场 #抖音818新潮好物节,08-02 16:56:51,33秒,--,--,37703,14472,700,Rainbow Couple
又开始容貌焦虑了，又开始折腾了，哎，不过很期待#8月3日中午12点彩虹生日破亿大场 #抖音818新潮好物节,08-02 15:31:43,58秒,--,--,11687,1492,135,Rainbow Couple
最终也不知道这些摄影师的眼睛被我治好没有？真担心他们！#8月3日中午12点彩虹生日破亿大场,08-01 15:14:12,40秒,--,--,14260,1078,178,Rainbow Couple
太难了太难了太难了#8月3日中午12点彩虹生日破亿大场 #抖音818新潮好物节,07-31 15:18:49,11秒,--,--,8951,3178,453,Rainbow Couple
抱歉上传错了，我已经惩罚弟弟不准生二胎了#8月3日中午12点彩虹生日破亿大场 #抖音818新潮好物节,07-28 23:25:08,17秒,--,--,12227,693,55,Rainbow Couple
为生日做准备，各种试吃，吃了一天了#8月3日中午12点彩虹生日破亿大场 #抖音818新潮好物节,07-28 23:01:33,17秒,--,--,3848,682,30,Rainbow Couple
即将跨入奔4的第一步，我越来越老，他越来越小#8月3日中午12点彩虹生日破亿大场 #抖音818新潮好物节,07-28 21:12:05,9秒,--,--,27077,1686,298,Rainbow Couple
优胜劣汰#8月3日中午12点彩虹生日破亿大场 #抖音818新潮好物节,07-28 17:40:56,14秒,--,--,6346,1354,59,Rainbow Couple
突然就有了高中时的感觉，他在对牛弹琴，我在斗弹琴的人#8月3日中午12点彩虹生日破亿大场,07-27 22:50:40,24秒,--,--,4395,1468,44,Rainbow Couple
即将迈入40岁的第一步，一定要开个好头，一定要足够给力#8月3日中午12点彩虹生日破亿大场,07-27 20:46:52,11秒,--,--,17638,8118,93,Rainbow Couple
夫妻吵架，床头吵床下和,07-25 20:51:28,24秒,--,--,23718,1722,243,Rainbow Couple
不承认，你能怎么滴，哈哈哈哈,07-25 20:49:33,9秒,--,--,21315,855,510,Rainbow Couple
如实告知，买得安心,07-25 20:46:54,1分8秒,--,--,18121,2712,1378,Rainbow Couple
思来想去，还是决定回应一下，因为有的话太难听。如果这样都不信，我也没办法了,07-25 20:23:17,22秒,--,--,134844,11098,444,Rainbow Couple
最对不起的就是这个小宝贝了，一天到晚看不到妈妈。不过幸好找了个很好的阿姨,07-25 20:07:19,25秒,--,--,26983,1120,90,Rainbow Couple
真好喝，哈哈,07-25 19:35:34,8秒,--,--,12417,1132,105,Rainbow Couple
我妈整天都在想方设法给我意粒但是我真的不想啊#老妈,07-25 15:55:14,57秒,--,--,27773,1135,116,Rainbow Couple
注意看店员的表情，哈哈哈,07-25 14:24:47,39秒,--,--,127555,6056,2332,Rainbow Couple
这几天没有更新，也在联络落实这个事，希望一切快快好起来#河南加油,07-25 09:57:21,25秒,--,--,87015,4135,249,Rainbow Couple
其实我也不愿意声嘶力竭，我想数据好看点，不想掉下来，感恩理解与包容,07-25 09:47:05,1分15秒,--,--,14177,2129,216,Rainbow Couple
让大家担心了，放心，已经没事了，和好了,07-25 09:31:58,59秒,--,--,186643,11588,1568,Rainbow Couple
尽力了，希望一切平安健康。我老公看到这个视频，不知道会不会气晕，我先把门反锁,07-21 21:23:44,54秒,--,--,406759,31722,5916,Rainbow Couple
一胎的时候几乎每天给我熬，二胎这是第一次#7月25日上午10点年中大庆,07-20 20:09:31,9秒,--,--,27001,2274,191,Rainbow Couple
